{"schema":"reader-experience-model-output-v2","scores":{"retention":50,"quizzes":50,"transfer":50,"practical":50,"summaries":50,"tone":50,"limits":50,"insight":50,"density":50,"beginner":50},"quizDerivation":{"answers":["a"],"mechanisms":["synthetic mechanism"],"confidence":["high"],"ambiguities":[],"tells":[],"evidenceRefIds":[["probe.chapter.1"]]},"recommendation":"SHIP","blockingFindings":[],"escalationSignals":[],"advisoryFindings":[],"strongestEvidenceRefIds":["probe.chapter.1"],"weakestEvidenceRefIds":["probe.chapter.1"],"oneParagraphVerdict":"Synthetic transport probe output."}
